Unnamed: 0,id,headline,summary,category,suggestions,img,Category
60,60,Ancient coins unearthed in desert cave could point to evidence of Maccabean revolt,"While he agreed the new find was an important discovery for the understanding of the period, Benedikt Eckhardt, a senior lecturer in ancient history at the University of Edinburgh, Scotland, said the Israeli interpretation of them belonging to a refugee fleeing the Maccabee revolt was just one possibility. Historians disagree over various details of the revolt, including its root cause; the Maccabees recapturing of Jerusalem and the rededication of the Second Temple are the origin of the Jewish festival of Hanukkah, which begins Sunday. The Israel Antiquities Authority announced that earlier this year, a team of experts found 15 silver coins that they say were hidden by a refugee fleeing the turmoil of the Maccabean revolt from 167160 B.C., when Jewish warriors rebelled against the Seleucid Empire.",sport,"[1, 2, 3]","https://media-cldnry.s-nbcnews.com/image/upload/t_fit-760w,f_auto,q_auto:best/rockcms/2022-12/221213-israel-maccabean-coins-mb-0916-ba86f1.jpg",sport
61,61,Moderna says personalized mRNA cancer vaccine is effective for advanced melanoma,"We are very excited, we are moving very quickly with Merck onto phase 3 for this study, Moderna CEO Stephane Bancel told CNBC Tuesday morning. The drugmakers said a combination of the vaccine and Mercks immunotherapy Keytruda led to a statistically significant improvement in survival before the cancer returned in patients with advanced melanoma. Moderna developed one of the most popular vaccines used to protect patients against Covid, and the drugmaker brought in more than 3 billion from its Spikevax in this years third quarter.",business,"[1, 2, 3]",https://static.adsafeprotected.com/skeleton.gif,business
62,62,We have 'ignition': Fusion breakthrough draws energy gain,"If scientists can work out more of the problems that have dogged fusion for seven decades, it would be a reliable source of power to work in concert with wind and solar power to boost the clean energy movement. 
U.S. scientists have achieved ignition   a fusion reaction that produced more energy than it took to create  a critical milestone for nuclear fusion and a step forward in the pursuit of a nearly limitless source of clean energy, Energy Department officials said Tuesday. As humans seek ways to power modern life without harming the planet, Dabbar said it was fitting that the ultimate source of clean energy would be the one we see every day in the sky: The sun, whose process of nuclear fusion scientists have spent decades trying to recreate.",business,"[1, 2, 3]",https://static.adsafeprotected.com/skeleton.gif,business
63,63,Biden signs same-sex marriage bill at White House ceremony,"Biden emphasized bipartisan support for the legislation, passed by Congress last week while calling for more to be done, including a renewed push for a bill to prohibit discrimination based on sex, sexual orientation or gender identity. And amid widespread antiLGBTQ rhetoric led by rightwing conservatives and a string of attacks on the community, including the deadly shooting at Club Q.
Biden signed the bill Tuesday a decade after he came out in public support of samesex marriage, a change for Biden, who had voted against recognition of samesex marriages when he was a senator. I am absolutely comfortable with the fact that men marrying men, women marrying women and heterosexual men and women marrying another are entitled to the same exact rights, all the civil rights, all the civil liberties, he added.",business,"[1, 2, 3]",https://static.adsafeprotected.com/skeleton.gif,business